{
  "schemaVersion": "1.0",
  "id": "d965d7a9-13b8-41ae-9cb2-4f1d158c8d22",
  "system": "daggerheart",
  "identity": {
    "name": "Street Bandit",
    "subtitle": "Tier 1 Minion"
  },
  "description": "A thief in simple clothes and small club, eager to prove themselves.",
  "tags": ["tier-1", "minion", "urban"],
  "source": {
    "origin": "imported",
    "sourceSystem": "daggerheart",
    "reference": "Street_Bandit.png"
  },
  "metadata": {
    "ownerId": "00000000-0000-0000-0000-000000000001",
    "status": "draft",
    "createdAt": "2026-08-21T00:00:00Z",
    "updatedAt": "2026-08-21T00:00:00Z"
  },
  "systemData": {
    "tier": 1,
    "role": "Minion",
    "motivations": ["Escape", "profit", "throw smoke"],
    "statistics": {
      "difficulty": 9,
      "thresholds": "None",
      "hitPoints": 1,
      "stress": 1,
      "attack": "+0",
      "weapon": "Club",
      "range": "Melee",
      "damage": "2 phy"
    },
    "experience": "Thief +2",
    "features": [
      {
        "name": "Minion (3) - Passive",
        "text": "The Street Bandit is defeated when they take any damage. For every 3 damage a PC deals to the Street Bandit, defeat an additional Minion within range the attack would succeed against."
      }
    ]
  }
}
